,date,username,tweet,hashtags,nlikes,sentiment
386,2021-07-30 01:53:07,DanInTheHam,Tell your Foxwatching vaccinechipfearing uncle that if he wants to be paranoid this is actually a logical place to start Chilling Actually everyone should listen to this  spying spyware journalism activism   httpstcotJQkH0tWPA,['spying' 'spyware' 'journalism' 'activism'],0,2.0
387,2021-07-30 01:50:07,dsphinx,RT thenewoilfreeradicalzone Snowden People Who Bankroll the Spyware Industry Should Be in Prison   httpstcoJEoIiYVEjt  httpstcohPrOvZ3UyR,[],0,0.0
388,2021-07-30 01:48:26,JanetWa94118686,Beltway Insider BidenCuba Pegasus Spyware PaulFauci Clash COVIDVaccine Totals Weinstein Bezos Olympics  httpstco81dcFj3iNu,[],0,0.0
389,2021-07-30 01:48:19,tekotaro_12,Leaks Expose Israeli Spyware Abused Worldwide  httpstcozJTyoTPhv2 via YouTube,[],0,0.0
390,2021-07-30 01:47:18,AGA_PBinUK,How to check if your smartphone is infected with pegasus spyware software  httpstcou2HETYhKgS,[],7,0.0
391,2021-07-30 01:47:04,dawn_,Money destined for buying medicine fire prevention amp etc was used to pay for Pegasus spyware in Mexico  httpstcohnMFq3G60O,[],9,0.0
392,2021-07-30 01:46:34,BhatParas,Afraid Pegasus will be seen as branch of CBI ED IT’ Shiv Sena criticises Centre on alleged surveillance The party said the use of Israelimade Pegasus spyware was an ‘assault on the freedom of the people of India’  PhogatFilms ShiningLinz3 james19665592 Shefali2303  httpstcoOBuz6qk7yz,[],7,2.0
393,2021-07-30 01:40:07,JanetWa94118686,Beltway Insider BidenCuba Pegasus Spyware PaulFauci Clash COVIDVaccine Totals Weinstein Bezos Olympics  httpstco4xvjNCDHa3,[],0,0.0
